{
  "taskID": 4,
  "version": "R2020b",
  "costFunction": "Whit2",
  "moduleSet": "StaeubliTx90",
  "moduleOrder": [ 0, 1, 2, 3, 4, 5, 6 ],
  "basePose": [
    [
      [ 1.0, 0.0, 0.0, 0.0 ],
      [ 0.0, 1.0, 0.0, -0.2 ],
      [ 0.0, 0.0, 1.0, 0.0 ],
      [ 0.0, 0.0, 0.0, 1.0 ]
    ]
  ],
  "cost": 9.950000000000001,
  "date": "2022-02-28",
  "author": [
    "Matthias Mayer"
  ],
  "email": [
    "matthias.mayer@tum.de"
  ],
  "affiliation": [
    "TU Muenchen"
  ],
  "computationTime": 0,
  "processorName": "Intel i7 3.5 Ghz",
  "trajectory": {
    "ddq": [
      [ 0, 0, 0, 0, 0, 0 ],
      [ 0, 0, 0, 0, 0, 0 ],
      [ 0, 0, 0, 0, 0, 0 ],
      [ 0, 0, 0, 0, 0, 0 ],
      [ -0.8994, 0.2137, 0.6412, 0.0005, -0.4275, -0.8999 ],
      [ -0.8994, 0.2137, 0.6412, 0.0005, -0.4275, -0.8999 ],
      [ -0.8994, 0.2137, 0.6412, 0.0005, -0.4275, -0.9 ],
      [ -0.8994, 0.2137, 0.6412, 0.0005, -0.4275, -0.8999 ],
      [ -0.8994, 0.2137, 0.6412, 0.0005, -0.4275, -0.8999 ],
      [ -0.8994, 0.2137, 0.6412, 0.0005, -0.4275, -0.9 ],
      [ -0.8994, 0.2137, 0.6412, 0.0005, -0.4275, -0.8999 ],
      [ -0.8994, 0.2137, 0.6412, 0.0005, -0.4275, -0.8999 ],
      [ -0.8994, 0.2137, 0.6412, 0.0005, -0.4275, -0.9 ],
      [ -0.8994, 0.2137, 0.6412, 0.0005, -0.4275, -0.9 ],
      [ -0.8994, 0.2137, 0.6412, 0.0005, -0.4275, -0.8999 ],
      [ -0.8994, 0.2137, 0.6412, 0.0005, -0.4275, -0.8999 ],
      [ -0.8994, 0.2137, 0.6412, 0.0005, -0.4275, -0.8999 ],
      [ -0.8994, 0.2137, 0.6412, 0.0005, -0.4275, -0.8999 ],
      [ -0.8994, 0.2137, 0.6412, 0.0005, -0.4275, -0.8999 ],
      [ -0.8994, 0.2137, 0.6412, 0.0005, -0.4275, -0.9 ],
      [ -0.8994, 0.2137, 0.6412, 0.0005, -0.4275, -0.8999 ],
      [ -0.8994, 0.2137, 0.6412, 0.0005, -0.4275, -0.8999 ],
      [ -0.8994, 0.2137, 0.6412, 0.0005, -0.4275, -0.8999 ],
      [ -0.8994, 0.2137, 0.6412, 0.0005, -0.4275, -0.8999 ],
      [ -0.8994, 0.2137, 0.6412, 0.0005, -0.4275, -0.9 ],
      [ -0.8994, 0.2137, 0.6412, 0.0005, -0.4275, -0.9 ],
      [ -0.8994, 0.2137, 0.6412, 0.0005, -0.4275, -0.8999 ],
      [ -0.8994, 0.2137, 0.6412, 0.0005, -0.4275, -0.8999 ],
      [ -0.8994, 0.2137, 0.6412, 0.0005, -0.4275, -0.8999 ],
      [ -0.8994, 0.2137, 0.6412, 0.0005, -0.4275, -0.9 ],
      [ -0.8994, 0.2137, 0.6412, 0.0005, -0.4275, -0.9 ],
      [ -0.8994, 0.2137, 0.6412, 0.0005, -0.4275, -0.8999 ],
      [ -0.8994, 0.2137, 0.6412, 0.0005, -0.4275, -0.8999 ],
      [ -0.8994, 0.2137, 0.6412, 0.0005, -0.4275, -0.8999 ],
      [ -0.8994, 0.2137, 0.6412, 0.0005, -0.4275, -0.9 ],
      [ -0.8994, 0.2137, 0.6412, 0.0005, -0.4275, -0.9 ],
      [ -0.8994, 0.2137, 0.6412, 0.0005, -0.4275, -0.9 ],
      [ -0.8994, 0.2137, 0.6412, 0.0005, -0.4275, -0.9 ],
      [ -0.8994, 0.2137, 0.6412, 0.0005, -0.4275, -0.8999 ],
      [ -0.8994, 0.2137, 0.6412, 0.0005, -0.4275, -0.9 ],
      [ -0.8994, 0.2137, 0.6412, 0.0005, -0.4275, -0.9 ],
      [ -0.8994, 0.2137, 0.6412, 0.0005, -0.4275, -0.9 ],
      [ -0.8994, 0.2137, 0.6412, 0.0005, -0.4275, -0.9 ],
      [ -0.8994, 0.2137, 0.6412, 0.0005, -0.4275, -0.8999 ],
      [ -0.8994, 0.2137, 0.6412, 0.0005, -0.4275, -0.9 ],
      [ -0.8994, 0.2137, 0.6412, 0.0005, -0.4275, -0.9 ],
      [ -0.8994, 0.2137, 0.6412, 0.0005, -0.4275, -0.8999 ],
      [ -0.8994, 0.2137, 0.6412, 0.0005, -0.4275, -0.9 ],
      [ -0.8994, 0.2137, 0.6412, 0.0005, -0.4275, -0.9 ],
      [ -0.8994, 0.2137, 0.6412, 0.0005, -0.4275, -0.8999 ],
      [ -0.8994, 0.2137, 0.6412, 0.0005, -0.4275, -0.8999 ],
      [ -0.8994, 0.2137, 0.6412, 0.0005, -0.4275, -0.8999 ],
      [ -0.8994, 0.2137, 0.6412, 0.0005, -0.4275, -0.9 ],
      [ -0.8994, 0.2137, 0.6412, 0.0005, -0.4275, -0.9 ],
      [ -0.8994, 0.2137, 0.6412, 0.0005, -0.4275, -0.8999 ],
      [ -0.8994, 0.2137, 0.6412, 0.0005, -0.4275, -0.8999 ],
      [ -0.8994, 0.2137, 0.6412, 0.0005, -0.4275, -0.8999 ],
      [ -0.8994, 0.2137, 0.6412, 0.0005, -0.4275, -0.9 ],
      [ -0.8994, 0.2137, 0.6412, 0.0005, -0.4275, -0.9 ],
      [ -0.8994, 0.2137, 0.6412, 0.0005, -0.4275, -0.8999 ],
      [ -0.8994, 0.2137, 0.6412, 0.0005, -0.4275, -0.8999 ],
      [ -0.8994, 0.2137, 0.6412, 0.0005, -0.4275, -0.8999 ],
      [ -0.8994, 0.2137, 0.6412, 0.0005, -0.4275, -0.8999 ],
      [ -0.8994, 0.2137, 0.6412, 0.0005, -0.4275, -0.8999 ],
      [ -0.8994, 0.2137, 0.6412, 0.0005, -0.4275, -0.8999 ],
      [ -0.8994, 0.2137, 0.6412, 0.0005, -0.4275, -0.9 ],
      [ -0.8994, 0.2137, 0.6412, 0.0005, -0.4275, -0.9 ],
      [ -0.8994, 0.2137, 0.6412, 0.0005, -0.4275, -0.8999 ],
      [ -0.8994, 0.2137, 0.6412, 0.0005, -0.4275, -0.8999 ],
      [ -0.8994, 0.2137, 0.6412, 0.0005, -0.4275, -0.8999 ],
      [ -0.8994, 0.2137, 0.6412, 0.0005, -0.4275, -0.8999 ],
      [ -0.8994, 0.2137, 0.6412, 0.0005, -0.4275, -0.8999 ],
      [ -0.8994, 0.2137, 0.6412, 0.0005, -0.4275, -0.8999 ],
      [ -0.8994, 0.2137, 0.6412, 0.0005, -0.4275, -0.8999 ],
      [ -0.8994, 0.2137, 0.6412, 0.0005, -0.4275, -0.8999 ],
      [ -0.8994, 0.2137, 0.6412, 0.0005, -0.4275, -0.8999 ],
      [ -0.8994, 0.2137, 0.6412, 0.0005, -0.4275, -0.9 ],
      [ -0.8994, 0.2137, 0.6412, 0.0005, -0.4275, -0.9 ],
      [ -0.8994, 0.2137, 0.6412, 0.0005, -0.4275, -0.8999 ],
      [ -0.8994, 0.2137, 0.6412, 0.0005, -0.4275, -0.8999 ],
      [ -0.8994, 0.2137, 0.6412, 0.0005, -0.4275, -0.8999 ],
      [ -0.8994, 0.2137, 0.6412, 0.0005, -0.4275, -0.8999 ],
      [ -0.8994, 0.2137, 0.6412, 0.0005, -0.4275, -0.8999 ],
      [ -0.8994, 0.2137, 0.6412, 0.0005, -0.4275, -0.8999 ],
      [ -0.8994, 0.2137, 0.6412, 0.0005, -0.4275, -0.8999 ],
      [ -0.8994, 0.2137, 0.6412, 0.0005, -0.4275, -0.9 ],
      [ -0.8994, 0.2137, 0.6412, 0.0005, -0.4275, -0.8999 ],
      [ -0.8994, 0.2137, 0.6412, 0.0005, -0.4275, -0.8999 ],
      [ -0.8994, 0.2137, 0.6412, 0.0005, -0.4275, -0.8999 ],
      [ -0.8994, 0.2137, 0.6412, 0.0005, -0.4275, -0.8999 ],
      [ -0.8994, 0.2137, 0.6412, 0.0005, -0.4275, -0.8999 ],
      [ -0.8994, 0.2137, 0.6412, 0.0005, -0.4275, -0.8999 ],
      [ -0.8994, 0.2137, 0.6412, 0.0005, -0.4275, -0.8999 ],
      [ -0.8994, 0.2137, 0.6412, 0.0005, -0.4275, -0.8999 ],
      [ -0.8994, 0.2137, 0.6412, 0.0005, -0.4275, -0.8999 ],
      [ -0.8994, 0.2137, 0.6412, 0.0005, -0.4275, -0.8999 ],
      [ -0.8994, 0.2137, 0.6412, 0.0005, -0.4275, -0.9 ],
      [ -0.8994, 0.2137, 0.6412, 0.0005, -0.4275, -0.8999 ],
      [ -0.8994, 0.2137, 0.6412, 0.0005, -0.4275, -0.8999 ],
      [ -0.8994, 0.2137, 0.6412, 0.0005, -0.4275, -0.8999 ],
      [ -0.8994, 0.2137, 0.6412, 0.0005, -0.4275, -0.8999 ],
      [ -0.8994, 0.2137, 0.6412, 0.0005, -0.4275, -0.8999 ],
      [ -0.8994, 0.2137, 0.6412, 0.0005, -0.4275, -0.8999 ],
      [ -0.8994, 0.2137, 0.6412, 0.0005, -0.4275, -0.8999 ],
      [ -0.8994, 0.2137, 0.6412, 0.0005, -0.4275, -0.8999 ],
      [ -0.8994, 0.2137, 0.6412, 0.0005, -0.4275, -0.9 ],
      [ -0.8994, 0.2137, 0.6412, 0.0005, -0.4275, -0.8999 ],
      [ -0.8994, 0.2137, 0.6412, 0.0005, -0.4275, -0.8999 ],
      [ -0.8994, 0.2137, 0.6412, 0.0005, -0.4275, -0.9 ],
      [ -0.8994, 0.2137, 0.6412, 0.0005, -0.4275, -0.8999 ],
      [ -0.8994, 0.2137, 0.6412, 0.0005, -0.4275, -0.8999 ],
      [ -0.8994, 0.2137, 0.6412, 0.0005, -0.4275, -0.9 ],
      [ -0.8089, 0.1922, 0.5767, 0.0005, -0.3845, -0.8094 ],
      [ 0.0904, -0.0214, -0.0645, 0, 0.043, 0.0905 ],
      [ 0.8994, -0.2137, -0.6412, -0.0005, 0.4275, 0.8999 ],
      [ 0.8994, -0.2137, -0.6412, -0.0005, 0.4275, 0.8999 ],
      [ 0.8994, -0.2137, -0.6412, -0.0005, 0.4275, 0.9 ],
      [ 0.8994, -0.2137, -0.6412, -0.0005, 0.4275, 0.8999 ],
      [ 0.8994, -0.2137, -0.6412, -0.0005, 0.4275, 0.8999 ],
      [ 0.8994, -0.2137, -0.6412, -0.0005, 0.4275, 0.9 ],
      [ 0.8994, -0.2137, -0.6412, -0.0005, 0.4275, 0.8999 ],
      [ 0.8994, -0.2137, -0.6412, -0.0005, 0.4275, 0.8999 ],
      [ 0.8994, -0.2137, -0.6412, -0.0005, 0.4275, 0.8999 ],
      [ 0.8994, -0.2137, -0.6412, -0.0005, 0.4275, 0.9 ],
      [ 0.8994, -0.2137, -0.6412, -0.0005, 0.4275, 0.9 ],
      [ 0.8994, -0.2137, -0.6412, -0.0005, 0.4275, 0.8999 ],
      [ 0.8994, -0.2137, -0.6412, -0.0005, 0.4275, 0.8999 ],
      [ 0.8994, -0.2137, -0.6412, -0.0005, 0.4275, 0.9 ],
      [ 0.8994, -0.2137, -0.6412, -0.0005, 0.4275, 0.9 ],
      [ 0.8994, -0.2137, -0.6412, -0.0005, 0.4275, 0.9 ],
      [ 0.8994, -0.2137, -0.6412, -0.0005, 0.4275, 0.8999 ],
      [ 0.8994, -0.2137, -0.6412, -0.0005, 0.4275, 0.8999 ],
      [ 0.8994, -0.2137, -0.6412, -0.0005, 0.4275, 0.9 ],
      [ 0.8994, -0.2137, -0.6412, -0.0005, 0.4275, 0.9 ],
      [ 0.8994, -0.2137, -0.6412, -0.0005, 0.4275, 0.8999 ],
      [ 0.8994, -0.2137, -0.6412, -0.0005, 0.4275, 0.8999 ],
      [ 0.8994, -0.2137, -0.6412, -0.0005, 0.4275, 0.9 ],
      [ 0.8994, -0.2137, -0.6412, -0.0005, 0.4275, 0.9 ],
      [ 0.8994, -0.2137, -0.6412, -0.0005, 0.4275, 0.8999 ],
      [ 0.8994, -0.2137, -0.6412, -0.0005, 0.4275, 0.8999 ],
      [ 0.8994, -0.2137, -0.6412, -0.0005, 0.4275, 0.9 ],
      [ 0.8994, -0.2137, -0.6412, -0.0005, 0.4275, 0.9 ],
      [ 0.8994, -0.2137, -0.6412, -0.0005, 0.4275, 0.9 ],
      [ 0.8994, -0.2137, -0.6412, -0.0005, 0.4275, 0.8999 ],
      [ 0.8994, -0.2137, -0.6412, -0.0005, 0.4275, 0.8999 ],
      [ 0.8994, -0.2137, -0.6412, -0.0005, 0.4275, 0.9 ],
      [ 0.8994, -0.2137, -0.6412, -0.0005, 0.4275, 0.9 ],
      [ 0.8994, -0.2137, -0.6412, -0.0005, 0.4275, 0.8999 ],
      [ 0.8994, -0.2137, -0.6412, -0.0005, 0.4275, 0.8999 ],
      [ 0.8994, -0.2137, -0.6412, -0.0005, 0.4275, 0.9 ],
      [ 0.8994, -0.2137, -0.6412, -0.0005, 0.4275, 0.9 ],
      [ 0.8994, -0.2137, -0.6412, -0.0005, 0.4275, 0.8999 ],
      [ 0.8994, -0.2137, -0.6412, -0.0005, 0.4275, 0.8999 ],
      [ 0.8994, -0.2137, -0.6412, -0.0005, 0.4275, 0.9 ],
      [ 0.8994, -0.2137, -0.6412, -0.0005, 0.4275, 0.9 ],
      [ 0.8994, -0.2137, -0.6412, -0.0005, 0.4275, 0.9 ],
      [ 0.8994, -0.2137, -0.6412, -0.0005, 0.4275, 0.8999 ],
      [ 0.8994, -0.2137, -0.6412, -0.0005, 0.4275, 0.8999 ],
      [ 0.8994, -0.2137, -0.6412, -0.0005, 0.4275, 0.9 ],